{
    "$id": "graphSchema",
    "$schema": "http://json-schema.org/draft-07/schema#",
    "title": "Graph Schema",
    "type": "object",
    "properties": {
      "uuid": {
        "type": "string",
        "description": "Unique identifier for the graph."
      },
      "name": {
        "type": "string",
        "description": "Name of the graph."
      },
      "description": {
        "type": "string",
        "description": "Description or notes about the graph."
      },
      "dictionaryID": {
        "type": "string",
        "description": "The dictionary used to define this graph's types and parameters."
      },
      "nodes": {
        "type": "array",
        "description": "An array of node objects in the graph."
      },
      "edges": {
        "type": "array",
        "description": "An array of edge objects in the graph."
      },
      "metadata": {
        "$ref": "metadataSchema"
      }
    },
    "required": ["uuid", "name", "dictionaryID", "nodes", "edges"]
  }
  